{
  "root": ".",
  "target_file": "examples/code_target.py",
  "marker": "# HYDRA-INJECT:slot",
  "mode": "after",
  "code": "\n\ndef injected_hook() -> str:\n    return \"bounded injection\"\n",
  "allow_extensions": [".py", ".md", ".json", ".toml", ".yml", ".yaml", ".txt"],
  "max_bytes": 20000,
  "rationale": "Demonstrate governed agent-authored code insertion into an explicit marker."
}

